{
  "$schema": "../../schemas/d3_t08_research_dataset_registry_contract.schema.json",
  "config_version": "1.0.0",
  "contract_id": "D3_T08_RESEARCH_DATASET_REGISTRY_CONTRACT_V1",
  "task_id": "D3-T08",
  "contract_status": "accepted",
  "contract_scope": "route_agnostic_research_dataset_registry_and_base_quality_audit",
  "source_task_id": "D3-T07",
  "source_table": "d3_candidate_daily_observation",
  "target_duckdb": "d3_t08_research_dataset_registry.duckdb",
  "research_dataset_route_agnostic": true,
  "dataset_registry_authorized": true,
  "schema_catalog_authorized": true,
  "field_catalog_authorized": true,
  "dataset_fingerprint_authorized": true,
  "base_quality_audit_authorized": true,
  "pcvt_indicator_specific_readiness_authorized": false,
  "pcvt_indicator_calculation_authorized": false,
  "pcvt_values_generation_authorized": false,
  "pcvt_scores_generation_authorized": false,
  "state_labels_generation_authorized": false,
  "r0_state_generation_authorized": false,
  "labels_generation_authorized": false,
  "returns_generation_authorized": false,
  "backtest_generation_authorized": false,
  "portfolio_generation_authorized": false,
  "formal_data_version_authorized": false,
  "input_gate_required_fields": [
    "d3_t07_generation_decision",
    "d3_candidate_observation_generated",
    "formal_data_version_published",
    "labels_generated",
    "returns_generated",
    "pcvt_values_generated",
    "r0_state_generated"
  ],
  "d3_t07_quality_blockers": [
    "duplicate_observation_key_count",
    "null_ohlc_count",
    "non_positive_price_count",
    "high_low_violation_count",
    "missing_effective_adj_factor_count",
    "factor_interval_unresolved_count"
  ],
  "target_tables": [
    "d3_research_dataset_registry",
    "d3_research_dataset_schema_catalog",
    "d3_research_dataset_field_quality",
    "d3_research_dataset_coverage_by_security",
    "d3_research_dataset_coverage_by_date",
    "d3_research_dataset_policy_usage",
    "d3_research_dataset_window_capacity"
  ],
  "base_quality_checks": [
    "primary_key_duplicate_check",
    "raw_ohlc_positive_check",
    "raw_high_low_check",
    "adjusted_ohlc_positive_check",
    "adjusted_high_low_check",
    "effective_adj_factor_positive_check",
    "adjusted_ohlc_factor_consistency_check",
    "listing_pause_absence_check",
    "policy_provenance_check",
    "source_task_id_check",
    "generated_by_task_check",
    "row_provenance_check"
  ],
  "window_capacity_policy": {
    "route_agnostic": true,
    "indicator_id_specific_readiness": false,
    "window_sizes": [15, 20, 21, 60, 80],
    "partition_key": "ts_code",
    "order_key": "trade_date"
  },
  "required_outputs": [
    "d3_t08_research_dataset_registry.duckdb",
    "d3_t08_generation_summary.json",
    "d3_t08_quality_report.json",
    "d3_t08_handoff_candidate_report.json",
    "d3_t08_schema_catalog.csv",
    "d3_t08_field_quality.csv",
    "d3_t08_coverage_by_security.csv",
    "d3_t08_coverage_by_date.csv",
    "d3_t08_policy_usage_summary.csv",
    "d3_t08_window_capacity_summary.csv",
    "d3_t08_candidate_file_hash_summary.json"
  ],
  "prohibited_fields": [
    "pcvt_value",
    "pcvt_score",
    "pcvt_state",
    "q_threshold",
    "state_machine_version",
    "state",
    "label",
    "future_return",
    "breakout_direction",
    "backtest_signal",
    "portfolio_return"
  ],
  "prohibited_outputs": [
    "data_version.json",
    "formal_manifest.json",
    "labels.csv",
    "returns.csv",
    "future_outcomes.csv",
    "backtest.csv",
    "portfolio.csv",
    "r0_state.csv",
    "pcvt_values.csv",
    "pcvt_scores.csv",
    "state_labels.csv"
  ],
  "next_planned_task": "R0-T01 PCVT candidate indicator specification"
}
